{
  "$schema": "https://json-schema.org/draft/2020-12/schema",
  "$id": "https://ttm-model-foundry/schemas/theory_input.schema.json",
  "title": "TheoryInput",
  "description": "Input contract for a single scientific theory consumed by ttm-model-foundry. Section 12 of the build brief.",
  "type": "object",
  "additionalProperties": true,
  "required": [
    "theory_id",
    "theory_name",
    "parent_kernel_id",
    "core_claim",
    "mechanism",
    "scope",
    "main_assumptions",
    "alternatives_ruled_out",
    "distinctive_falsifiable_prediction",
    "what_would_falsify_it",
    "notes"
  ],
  "properties": {
    "theory_id": {
      "type": "string",
      "minLength": 1,
      "description": "Stable identifier of the theory, e.g. T01."
    },
    "theory_name": {
      "type": "string",
      "minLength": 1
    },
    "parent_kernel_id": {
      "type": "string",
      "minLength": 1,
      "description": "Identifier of the upstream kernel that produced this theory."
    },
    "core_claim": {
      "type": "string",
      "minLength": 1,
      "description": "Verbatim statement of the central mechanistic claim."
    },
    "mechanism": {
      "type": "string",
      "minLength": 1
    },
    "scope": {
      "type": "string",
      "minLength": 1
    },
    "main_assumptions": {
      "type": "array",
      "minItems": 1,
      "items": {"type": "string", "minLength": 1}
    },
    "alternatives_ruled_out": {
      "type": "array",
      "items": {"type": "string", "minLength": 1}
    },
    "distinctive_falsifiable_prediction": {
      "type": "string",
      "minLength": 1,
      "description": "Required and non-empty. The Ontologist converts this into M's pre-registered falsification signatures."
    },
    "what_would_falsify_it": {
      "type": "string",
      "minLength": 1,
      "description": "Required and non-empty. The Ontologist converts this into M's pre-registered falsification signatures."
    },
    "notes": {
      "type": "string"
    }
  }
}
